Имя,Ссылка,Изображение,Дата публикации,Время публикации,Описание
Владимир Бережных о возрождении въездного туризма в России,https://visit-russia.ru/ru/novosti/691-.html,https://visit-russia.ru/images/arc_1/vladimir_berezhnih_o_vozrozhdenii_vezdnogo_turizma_v_rossii.jpg,11.09.2020,10:00,"Пандемия показала, насколько туристская отрасль важна для занятости населения, для местных бюджетов, в целом для страны. Летом эта сфера несколько ожила за счет внутреннего туризма, но его объемов явно не хватает даже на то, чтобы хотя бы частично закрыть имеющиеся предложения по туристским услугам на территории России.
Упали ниже плинтуса объемы российского экспорта ус......"
Китай и туризм на первой пост-пандемийной выставке в Москве,https://visit-russia.ru/ru/novosti/692-.html,https://visit-russia.ru/images/arc_1/kitaj_i_turizm_na_pervoj_post-pandemijnoj_vistavke_v_moskve.jpg,10.09.2020,10:00,"О китайском туризме, вызовах времени и дальнейших планах поговорили с генеральным директором компании «ЧАЙНА ТУР ЭНД БИЗНЕС ТРЭВЭЛ», Председателем Совета РУССКО-КИТАЙСКОГО КЛУБА Сергеем Джан Ша.
Несмотря на закрытые границы с большинством стран, на международном форуме-выставке ""Отдых Leisure"" всё-таки были представлены некоторые, в числе которых также были и Китай. Кор......"
Большинство китайских туристов в России хотят пробовать местную кухню,https://visit-russia.ru/ru/novosti/693-.html,https://visit-russia.ru/images/arc_1/bolshinstvo_kitajskih_turistov_v_rossii_hotyat_probovat_mestnuyu_kuhnyu.jpg,10.09.2020,10:00,"Большинство китайских туристов в России хотят пробовать блюда местной кухни, - свидетельствуют данные опроса информационного агентства Sputnik и компании Eurasian Tianli (Beijing) Technology Co., Ltd (является членом туристической ассоциации «Мир без границ»).
Желание во время поездки «по возможности ознакомиться с блюдами местной кухни» высказали 41,3% респондентов, 29,......"
Владимир Джао: «Настоящий герой всегда вновь поднимается и взмывает ввысь!»,https://visit-russia.ru/ru/novosti/694-.html,https://visit-russia.ru/images/arc_1/vladimir_dzhao_nastoyashij_geroj_vsegda_vnov_podnimaetsya_i_vzmivaet_vvis.jpeg,09.09.2020,10:00,"Восстановление и поступательное развитие российско-китайских туристических обменов предопределены историей, географическим положением, интегрированностью экономических систем и миллионами человеческих связей.
Наш сегодняшний собеседник – Владимир Джао, российский бизнесмен китайского происхождения – глава кейтеринговой компании «Аэромар», владелец газеты The Moscow Tim......"
В Китае прошла первая после пандемии офлайн-выставка,https://visit-russia.ru/ru/novosti/695-.html,https://visit-russia.ru/images/arc_1/v_kitae_proshla_pervaya_posle_pandemii_oflajn-vistavka.jpg,09.09.2020,10:00,"С 3 по 7 сентября в Пекине прошла первая в Китае после пандемии офлайн выставка World Winter Sports EXPO-2020, посвященная зимним видам спорта.
Зимние турпродукты России были представлены на российском объединенном стенде, сформированном посольством РФ, сотрудниками китайской компании «Евразиан Тянли».
Генеральный директор «Евразиан Тянли» Александр Фолько, явл......"
Китайских туристов будут привлекать в РФ при помощи инноваций,https://visit-russia.ru/ru/novosti/696-.html,https://visit-russia.ru/images/arc_1/kitajskih_turistov_budut_privlekat_v_rf_pri_pomoshi_innovacij.jpg,08.09.2020,10:00,"Китайских туристов в РФ будут привлекать при помощи инновационных продуктов, - рассказали агентству «Спутник» представители российской туриндустрии.
Основатель проекта VR Baikal Кирилл Казаков отметил, что в ближайшее время выйдет бесплатно мобильное приложение на китайском языке, которое позволит китайским туристам совершать виртуальные путешествия по озеру Байкал и ег......"
«Мир без границ» и журнал «Retail &amp; Loyalty» проводят круглый стол &quot;Российский ритейл и китайские туроператоры&quot;,https://visit-russia.ru/ru/novosti/697-retail-amp-loyalty-quot-quot.html,https://visit-russia.ru/images/arc_1/mir_bez_granic_i_zhurnal_retail_amp_loyalty_provodyat_kruglij_stol_quotrossijskij_ritejl_i_kitajskie.jpg,08.09.2020,10:00,"Уважаемые коллеги!
В рамках проведения мероприятий по формированию экспертного сообщества в отраслях бизнеса, связанных с приемом и обслуживанием китайских туристов, и в преддверии возвращения турпотока из Китая, туристическая ассоциация «Мир без границ» и журнал «Retail & Loyalty» приглашают Вас принять участие в круглом столе, посвященном привлечению китайских тур......"
Китай приоткрывается. Как изменится въездной туризм в Россию из КНР?,https://visit-russia.ru/ru/novosti/698-.html,https://visit-russia.ru/images/arc_1/kitaj_priotkrivaetsya_kak_izmenitsya_vezdnoj_turizm_v_rossiyu_iz_knr.jpg,08.09.2020,10:00,"Эксперты видят в открытии аэропорта Пекина признаки начала возвращения Китая на международный рынок поездок. «Вестник АТОР» выяснял, когда в Россию поедут туристы из Китая, и как будет восстанавливаться турпоток.
Аэропорт Пекина сообщил о постепенном восстановлении своей работы. Как пишут СМИ, первое время столица Китая будет принимать только 500 авиапассажиров......"
О сроках приема заявок для предоставления субсидий на государственную поддержку туроператоров,https://visit-russia.ru/ru/novosti/700-.html,https://visit-russia.ru/images/arc_1/o_srokah_priema_zayavok_dlya_predostavleniya_subsidij_na_gosudarstvennuyu_podderzhku_turoperatorov.png,04.09.2020,10:00,"Федеральное агентство по туризму в соответствии с Правилами предоставления субсидий из федерального бюджета на государственную поддержку туроператоров, обеспечивающих прирост количества посетивших Российскую Федерацию иностранных туристов (далее — субсидии), утвержденными постановлением Правительства Российской Федерации от 30 апреля 2019 г. № 534, извещает:
— срок нача......"
Из-за запрета на поездки жители Китая устремляются в местные парки развлечений,https://visit-russia.ru/ru/novosti/711-.html,https://visit-russia.ru/images/arc_1/iz-za_zapreta_na_poezdki_zhiteli_kitaya_ustremlyayutsya_v_mestnie_parki_razvlechenij.jpg,04.09.2020,10:00,"Пекин. Вести Туризм.
В Китае все еще действует запрет на выезд за пределы страны из-за пандемии, в результате чего китайские тематические парки переживают бум посещаемости, сообщает в своём обзоре The Wall Street Journal (WSJ), со ссылкой......"
Китайские путешественники пока выбирают частные туры в небольших группах,https://visit-russia.ru/ru/novosti/712-.html,https://visit-russia.ru/images/arc_1/kitajskie_puteshestvenniki_poka_vibirayut_chastnie_turi_v_nebolshih_gruppah.jpg,04.09.2020,10:00,"Пекин. Вести Туризм.
После COVID-19 всё больше китайских внутренних путешественников выбирает небольшие частные туры. Число частных групповых бронирований туров выросло на 385% после возобновления межпровинциального туризма около месяца назад, сообщает China Daily со с......"
"Названы блюда, которые китайские туристы не могут есть в России",https://visit-russia.ru/ru/novosti/713-.html,https://visit-russia.ru/images/arc_1/nazvani_blyuda-_kotorie_kitajskie_turisti_ne_mogut_est_v_rossii.jpg,04.09.2020,10:00,"МОСКВА. 2 СЕНТЯБРЯ. ИНТЕРФАКС-ТУРИЗМ – Генеральный директор туроператора ""Интурист"" в городе Шэньчжэнь Алекс рассказал, какие блюда русской кухни китайцы любят, а к каким не притронутся при путешествии в Россию.
""Одно из любимых блюд русской кухни у китайцев – уха, рыбный суп. При этом самое яркое впечатление на них производит борщ. В Китае тоже есть борщ, название которого так и перево......"
Нижний Новгород – в ТОП популярных городов России у туристов из КНР,https://visit-russia.ru/ru/novosti/715-.html,https://visit-russia.ru/images/arc_1/nizhnij_novgorod_v_top_populyarnih_gorodov_rossii_u_turistov_iz_knr.jpg,01.09.2020,10:00,"Нижний Новгород - один из наиболее посещаемых китайскими туристами городов России, заявил в интервью ИА «Вести Туризм» Илья Лагутин, директор департамента предпринимательства и туризма Нижнего Новгорода.
По его словам, в город удобно приехать, так как Нижний Новгород связан со столицей скоростным железнодорожным сообщением.
«В городе много старинных достоприме......"
Российская и китайская туристические ассоциации совместно запустят новую коммуникационную платформу,https://visit-russia.ru/ru/novosti/716-.html,https://visit-russia.ru/images/arc_1/rossijskaya_i_kitajskaya_turisticheskie_associacii_sovmestno_zapustyat_novuyu_kommunikacionnuyu_platformu.jpg,28.08.2020,10:00,"Российская туристическая ассоциация «Мир без границ» совместно с Китайской ассоциацией туристического сервиса разрабатывают коммуникационную платформу под названием China Friendly Chat, которая объединит туристический бизнес из двух стран, - сообщил в интервью агентству новостей «Спутник» член Совета ассоциации «Мир без границ» Александр Львов.
Эксперт сказал, что это......"
Ловцы хайпа на китайской волне,https://visit-russia.ru/ru/novosti/717-.html,https://visit-russia.ru/images/arc_1/lovci_hajpa_na_kitajskoj_volne.jpg,27.08.2020,10:00,"С наступлением «эры ковида» страсти в рунете по поводу китайского туризма практически сошли на нет. Если о нём и говорится, то, скорее, с заметной нотой тоски по утраченному рынку экспорта услуг. Или, говоря проще, по тем, кто еще не так давно в основных центрах российского туризма был едва ли не главным покупателем гостиничных......"
Частные инвестиции в проект трансграничной канатной дороги через Амур вырастут вдвое,https://visit-russia.ru/ru/novosti/718-.html,https://visit-russia.ru/images/arc_1/chastnie_investicii_v_proekt_transgranichnoj_kanatnoj_dorogi_cherez_amur_virastut_vdvoe.jpg,26.08.2020,10:00,"Группа компаний «Регион», выступающая инвестором строительства трансграничной канатной дороги Благовещенск – Хэйхэ, в связи с корректировкой проекта в два раза увеличивает объём инвестиций. На реализацию проекта компания направит 4,6 млрд рублей вместо 2,2 миллиардов.
Основные проектные изменения затрагивают терминал и пропускную способность канатки. Площадь четырёхэтажного здания решен......"
"Взгляд изнутри и со стороны. Фан Фэй о трудностях перевода, китайских гидах и продвижении России за рубежом.",https://visit-russia.ru/ru/novosti/719-.html,https://visit-russia.ru/images/arc_1/vzglyad_iznutri_i_so_storoni_fan_fej_o_trudnostyah_perevoda-_kitajskih_gidah_i_prodvizhenii_rossii_za_rubezhom.jpg,26.08.2020,10:00,"Москва. Вести Туризм. Андрей Щегольков.
У нас в гостях наш коллега - журналист Фан Фэй (Fang Fei). Он приехал в Москву 15 лет назад и прекрасно говорит по-русски. Несколько лет назад он открыл проект «Серый мокко» — первый подкаст о жизни в России на китайском языке. Его читают практически все китайцы, которые интересуются Россией. Мы поговорили с Фан Фэеем на темы тури......"
С 5 по 6 ноября в Санкт-Петербурге пройдёт Международный форум стран БРИКС,https://visit-russia.ru/ru/novosti/701-5-6.html,https://visit-russia.ru/images/arc_1/s_5_po_6_noyabrya_v_sankt-peterburge_projdyot_mezhdunarodnij_forum_stran_briks.jpg,25.08.2020,10:00,"С 5 по 6 ноября 2020 года в Санкт-Петербурге состоится второй Международный муниципальный форум стран БРИКС, в ходе которого, помимо основных тем, будут детально осуждаться вопросы развития туристической отрасли. Об этом было заявлено 13 августа в рамках онлайн заседания «круглого стола» Туристической Ассоциации «Мир Без Границ» по вопросам въездного туризма из Китая.
Предполагается,......"
Иван Введенский: «Мы видим раздробленность в действиях регионов по проекту «Государева дорога»,https://visit-russia.ru/ru/novosti/720-.html,https://visit-russia.ru/images/arc_1/ivan_vvedenskij_mi_vidim_razdroblennost_v_dejstviyah_regionov_po_proektu_gosudareva_doroga.jpg,25.08.2020,10:00,"Глава Ассоциации «Мир без границ» считает, что в будущем это самый мощный межрегиональный проект, но сейчас у его участников есть соблазн выдать желаемое за действительное.
В перспективе маршрут «Государева дорога» - это самый мощный межрегиональный проект, хорошо обеспеченный транспортными возможностями и кадровым резервом, у него блестящие маркетинговые и инвестиционные возможности,......"
Турбизнес предлагает Минэкономразвитию обратить больше внимания на онлайн,https://visit-russia.ru/ru/novosti/702-.html,https://visit-russia.ru/images/arc_1/turbiznes_predlagaet_minekonomrazvitiyu_obratit_bolshe_vnimaniya_na_onlajn.jpg,24.08.2020,10:00,"Ассоциация «Мир без границ» направила в Минэкономразвития свои предложения по вопросам информационной поддержки турбизнеса в сфере инкаминга (запрос от ведомства был получен в конце прошлого месяца).
Ассоциация провела два круглых стола, а также анкетирование членов объединения и других заинтересованных организаций, обобщив информацию более чем от 200 представителей индустрии гостеприим......"
